id,category,item_name,brand,retail_price,department,rank,sku
1,Socks & Hosiery,Comfort Choice Plus Size 6-Pack Multi Textured Trouser Socks,Comfort Choice,16.99,Women,31333,84737d8f7ef778a4bbfaf70ef2ce9541
2,Blazers & Jackets,Anne Klein Women's Plus-Size Classic Blazer,Anne Klein,109,Women,131783,c192112c8a3f721afadc9ccdc0e7e651
3,Tops & Tees,Allegra K Women Batwing Sleeve Portrait Letters Print Front Gray Tunic Shirt S,Allegra K,11.49,Women,3142,32a3750b2c972764f511dc149e4160a7
4,Swim,Columbia Sportswear Men's Backcast II Water Trunk,Columbia,29.99,Men,2614,d88e8a96b19f7de0cafab926f45647ac
5,Tops & Tees,Eddie Bauer Favorite 3/4 Sleeve Scoop-Neck T-Shirt,Eddie Bauer,27.95,Women,24200,7c81bfb7ce3fe8a77956a9ec23352288
6,Suits & Sport Coats,Alfani Red Gray Wool LS 2 Button Sport Coat,Alfani,227.5,Men,543733,3f79bcb5b7ea2dcc8bc8c5574a22bd11
7,Shorts,Calvin Klein Jeans Women's Pocket And Seam Short,Calvin Klein Jeans,13.31,Women,166417,6a08bca365930c059c543bf3fd981b1d
8,Swim,Rusty Hot Lava 4-Way Stretch Boardshort - Black,Rusty,59.5,Men,454546,1d5544255550801ac3b28d5940b4d754
9,Fashion Hoodies & Sweatshirts,Allegra K Men Long Sleeve Pullover Drawstring Casual Hoodie Coat Black S,Allegra K,15.6,Men,151040,4d631f1887b3a03a5c6a22f61573a770
10,Active,Minus33 100% Merino Wool Base Layer 814 Women's MidWeight 1/4 Length Zip Top,Minus33 Merino Wool,70,Women,20715,80c2436a4acbbe9babcd66e48822c1ab
11,Swim,Miraclesuit Women's Solid Lisa Jane Swimsuit,Miraclesuit,160,Women,310899,df8278bd465f8beb6816c0a0e04e2360
12,Tops & Tees,Mad Engine Men's Coca Cola Coke Classic Tee,Mad Engine,25.99,Men,39293,b8d392a3ed283e67c7359c9f30c32b8d
13,Socks,Gold Toe Cotton Quarter 6-Pack Socks,Gold Toe,20,Men,83062,292d1c7e9b899b17f24a1b37379ad0d5
14,Pants & Capris,Dickies Girl Junior's 5 Pocket Skinny Pant,Dickies Girl,30,Women,1774,5c368b9c5c6d77fdd5ca114c9ab7b38f
15,Swim,Speedo Women's Off the Grid Endurance+ Flyback Performance Swimsuit,Speedo,82,Women,57912,751977f24acefe442767e525e57e2134
16,Jumpsuits & Rompers,Adidas Women's Jeremy Scott Animal Print Jumper Jumpsuit-Dark Yellow,adidas,350,Women,117821,d8ff06985efc83b32eef77f07538eb27
17,Maternity,Nizo Wear Solace Comfort Nursing Bra With Healing Pocket,Nizo Wear,26.99,Women,6015,8d9464073aaee19bf74d771051db5688
18,Fashion Hoodies & Sweatshirts,Armada Men's Tri Fleece Hoodie,Armada,89.95,Men,533235,281a1b3cced8107d26863242bf0a7180
19,Maternity,A Pea in the Pod: Short Sleeve Scoop Neck Variegated Stripe Maternity T Shirt,A Pea in the Pod,59.5,Women,834971,a6a7b491de743eba71b146bc6680b5ce
20,Outerwear & Coats,Marc New York by Andrew Marc Men's Keenan Wool Twill Car Coat,Marc New York by Andrew Marc,150.75,Men,49827,f6dade518ef506da22817bdd3aff0d51
21,Plus,Buxton Checkbook Cover and Credit Card Holder,Buxton,14.99,Women,8760,d7b3d2686e2303c3a81cb8f2531ea09c
22,Suits & Sport Coats,Men's Single Breasted 2 Button Black Extra Fine Slim Fit Tuxedo,Caravelli,89.95,Men,231027,18b7c7780185e028b250645f431b38ee
23,Active,Capezio Women's No Show Liner With 5-pair Pre-pack Socks,Capezio,12.48,Women,5320,4ab1f6a613e0c7a09f2c80fb9ffe6553
24,Socks & Hosiery,LOCOMO Women Snow Snowflake Christmas Pattern Ankle Length Footless Pantyhose Legging Tight Pant FFT025s02 One Size Multicolored,LOCOMO Leggings,11.99,Women,1061,4d1bc78975a2da6278522f1375232fe1
25,Sweaters,Scotch & Soda Men's Fair Isle Crewneck Sweater,Scotch & Soda,81.9,Men,138622,31ef99c20fc83028586d3983231fea5a
26,Swim,Reebok Women's Sugarcoat Color Block Swimwear,Reebok,94,Women,156596,caf9f78046a21a80a7583533615bd1d0
27,Suits & Sport Coats,Elegant Men's Shinny Grey Slim Fit Two Button Suit with Slim Notch Lapel with Black Satin Trim,King Formal Wear,79.99,Men,290825,e798faea777ad348b975697d2e870686
28,Accessories,Kate Spade New York Mikas Pond-Holly Wallet,Kate Spade,58,Women,9384,48d16b0250a589189e256c4f20ce419e
29,Sweaters,American Apparel Unisex Fisherman's Pullover,American Apparel,78,Women,185132,d8a1dfae03054073a780973251998005
30,Jeans,7 For All Mankind Men's Standard Jean,7 For All Mankind,94.49,Men,91981,32560cfc4e06eacef3fcecd2e6c90c1c
31,Socks & Hosiery,Donna Karan The Signature Collection Sueded Jersey Control Top Pantyhose 0B110,Donna Karan,54,Women,50357,d1bf76d25ae7b2a448875b5eb45cfa9f
32,Accessories,Oakley Men's M Frame Replacement Lens,Oakley,55,Men,27135,a9c54d7ea55ff1eca39c15c126e2f805
33,Suits,Tahari Cliff Skirt Suit,Tahari,196.18,Women,715859,e498c611cad99757f61f1e34487a2b13
34,Suits & Sport Coats,DKNY Mens 2 Button Brown Black Texture Wool Sport Coat Jacket,DKNY,99.99,Men,360874,051a6fbf7aebadedc41f3cb859440e27
35,Blazers & Jackets,Allegra K Lady Stripes Epaulet Peaked Lapel Blazer Black White,Allegra K,14.21,Women,321158,f76468ea9176bda3dd348e05d001d176
36,Suits & Sport Coats,DC Men's Juneau Jacket,DC,99.5,Men,31046,87b5e7c94cde78641f5cff5109fb973b
37,Tops & Tees,Icebreaker Men's Everyday Short Sleeve Crewe Top,Icebreaker,64.99,Men,72455,d047efd7b587b2e2184d9c2b01f40e6d
38,Swim,Hurley Men's P60 Kings Road Boardshort,Hurley,65,Men,30859,b03c866cf7edcda64e00754e0a3acd90
39,Socks & Hosiery,Gold Toe Women's Floral Diamonds And Leaf Pattern 3 Pack Socks,Gold Toe,16,Women,8236,c3ecc8b2a89cb2fbc38d0f0304e84d62
40,Outerwear & Coats,Enyce By Sean John Men's Snorkel Coat Jacket Parka Faux Fur Snow Toggle,Enyce,39.99,Men,14569,ef8316a355ed725e37bebbedbf3a25ff
41,Fashion Hoodies & Sweatshirts,DC Men's Thresher Fullzip Fleece Sweater,DC,59.5,Men,83447,c5eebd49b7367bbda6c924fac87276c1
42,Suits,(6252) Pinstripe Tailored Boot Leg Trouser Suit,Ice,57.99,Women,105937,c526f5a42822a1eb1392ad38eb36ed4d
43,Suits & Sport Coats,Tommy Hilfiger Men's Button Vent Trim Fit Blazer,Tommy Hilfiger,140,Men,47621,943d12a2874ab509d27a04638131ae67
44,Sweaters,French Connection Men's Auderly Contrast Cardigan,French Connection,98,Men,81026,c9a487cd46e30e3147129da6b09d3890
45,Active,Glamorise Women's Active Comfort Wrap Bra,Glamorise,31.99,Women,4458,12d4dc1c0af9ff1b27bf1c7fc05eb439
46,Plus,Gold Toe Women's 6 Pack Turn Cuff,Gold Toe,15,Women,319,567057aa348e0f18a7918a185a975bb3
47,Sleep & Lounge,Beer Phrases Black Lounge Pants for men,Fun Boxers,18.5,Men,162826,380d978b21926a65a761177a3557b91f
48,Shorts,Southpole Men's Premium Wash Denim Shorts,Southpole,33,Men,257318,766d154b8a932ddcadc2141ca71e5940
49,Active,Dickies Men's 13 Inch Inseam Loose Fit Striped Work Short With Multi Use Pocket,Dickies,59.99,Men,9123,a6a55c9c6f02a9e59dd5fea6c1a043f4
50,Pants,Dickies Mens Slim Straight Fit Pant,Dickies,35,Men,479,c03c7cbc9bcd887ebf794f98279d6399
51,Suits & Sport Coats,Michael Kors Mens 2 Button Gray Plaid Silk Wool Sport Coat Jacket,Michael Kors,99.99,Men,776089,6c486e87d0e9d9f9646aa4b619c36d49
52,Dresses,Calvin Klein Women's Chiffon Dress,Calvin Klein,128,Women,259656,ae6ce6d095c8a32e02ec0243aef38740
53,Blazers & Jackets,Allegra K Woman Long Sleeve Lapel Collar Crop Jacket Coat Black M,Allegra K,13.65,Women,12877,93ad954aa0fe18461e0c43090a404708
54,Fashion Hoodies & Sweatshirts,Adult Unisex Live Love Crew Zip Hoodie,Activewear Apparel,41.99,Women,286615,3b0b3118f4556b81836ab5ef90c4f11d
55,Accessories,Croakies Unisex Adult Terra Spec Cord Adjustable Eyewear Retainer,Croakies,8.94,Women,10800,51299e57ec93a1b43e795d1f714db5f5
56,Suits & Sport Coats,Allegra K Men Sleeveless Single Breasted Deep V Neck Two Patch Pokcets Vest Black XS,Allegra K,16.61,Men,674694,66f67641a456fdf9feb258c94b1b1a4f
57,Pants & Capris,Sag Harbor Women's Ponte Pant,Sag Harbor,22.99,Women,15103,c3e0d3e0404f8e9aed2a59d8b948167f
58,Skirts,Allegra K Women Black Asymmetrical High Low Hem Elastic Waistband Skirt XS,Allegra K,9.19,Women,38492,cca951d3586ae92f8460ec1313859958
59,Outerwear & Coats,Black Faux Leather Bomber Jacket with Removable Knit Hood,Outerwears,69.99,Women,138543,f965f79ecea6e58f4c46e9fcfa429605
60,Socks,Darn Tough - CoolMax 1/4 Sock Cushion,Darn Tough,16,Men,56922,2b97d2c15d83038c99facaa5973f2bfd
61,Shorts,O'Neill Arcola Plaid Walkshort - Stone,O'Neill,34.65,Men,1200606,f2f3c6770d22fdd6b421e4722906bdd5
62,Dresses,Bailey 44 Women's Balls To The Wall Dress,Bailey 44,196,Women,82137,8764a34f5104fc37224a15afeb2a8c71
63,Plus,Cashmere Like Viscose Super Soft Faux Pashmina Wrap,Symphony Designs,6,Women,103767,83e64e2269b8cdecb11a0a0d2c9baeb3
64,Leggings,Allegra K Woman Black Faux Leather Elastic Waist Skinny Pants Leggings S,Allegra K,8.19,Women,2752,b68fb47f438cc334f85235182ca4cdef
65,Tops & Tees,HANES 4.2 oz NANO-T Originals V-Neck T-Shirt - 4551,Hanes,11,Men,13751,cf82c6ce8dca86b30dbc465cbe087455
66,Maternity,Elomi Beatrice Soft Cup Nursing Bra,Elomi,56,Women,9859,caef853c13535ce1004195974369ce9a
67,Socks,Wrightsock Men's Coolmesh Ii Quarter Single Pack Socks,Wrightsock,28.45,Men,8265,e9c0d45e9b5e12d654cf7d4f594d44c7
68,Intimates,Vanity Fair Women's Vanity Fair Body Caress Wirefree Bra #72335,Vanity Fair,34,Women,6367,6179187ed303bca1f31c1a3491c3ef43
69,Jumpsuits & Rompers,AX Paris Floral Print Romper,AxParis,24.99,Women,1141917,54c7903c9314fd1eab884ef2bb29f6b3
70,Clothing Sets,Aeropostale Juniors' Times Square 87 Graphic T-Shirt and A87 Racerback Ribbed Tank - Size (Large),Aeropostale,39.99,Women,2386019,735b7771d57ecd7c0f6c43ba153ebde3
71,Tops & Tees,Patty Women Diagonal One Shoulder with Neck Warmer Tops,Patty,28.74,Women,14440,6ec0971259b6e6f4ff1e70f02ba34aaa
72,Fashion Hoodies & Sweatshirts,Caterpillar Men's Camo Full Zip Sweatshirt,Caterpillar,69.99,Men,228571,e20fe192528a4f80ad7d4cff3dbe3d1e
73,Pants,Matix Men's Mj Cord,Matix,65,Men,424864,bbfbc7165bde8ab105ad87e3bab8e1d8
74,Tops & Tees,Marc Ecko Cut & Sew Men's Moto Photo Tee,Marc Ecko Cut & Sew,25,Men,106592,813fac01714317865cb3163d22746996
75,Swim,SWIM SYSTEMS Azul Wear it 3 ways D-cups. Criss cross; over the shoulder; halter. top only,Swim Systems,74,Women,330338,bb7cf77e54cfbba8f6be3771fdafa90b
76,Outerwear & Coats,IWB By Blac Label Men's Hunting Puffer Jacket Vest Polo,Blac Label,14.99,Men,13980,205b536c4618e5e8aed45fe756ae5889
77,Shorts,Rocawear Men's 969 Core Short,Rocawear,49.5,Men,259579,cb14286cf8ae2730b0aed8ea2d68b3fb
78,Blazers & Jackets,Switchblade Stiletto PUNK BLAZER- In Choice of Colors and Patterns,Switchblade Stiletto,76,Women,164341,d96e67aafe5189f4821cfead48acf129
79,Jeans,7 For All Mankind Women's Classic Bootcut Jean in Heritage,7 For All Mankind,189,Women,74381,93a6b0eb3936d2ab90cf65bf0202404e
80,Suits & Sport Coats,Paul Fredrick Herringbone Wool Blend Double-Breasted Suit,Paul Fredrick,424.5,Men,803798,8f6150459ce5588bda6e2d0620ef8a35
81,Swim,Mens New Hot Print Bikini Swimsuit Gary Majdell Sport,Gary Majdell Sport,17.97,Men,25563,5cb2d56e560006c368dfb192a89e6e38
82,Swim,Fox Racing Big Shot Boardshort Flame Red W31,Fox,48.65,Men,162548,40fb65d059f857c5db119583bda9bbc8
83,Skirts,Allegra K Woman Low-high Hem Stretchy Waistband Midi Skirt Solid Cyan M,Allegra K,9.31,Women,47204,5d1e2ad7b3fa33c7cbc1de7212dc0ff3
84,Fashion Hoodies & Sweatshirts,12XLShop Hooded Sweat Jacket with Tribal Motif,12XLShop Inc.,54.9,Men,205057,f6a6e7c8062c1b07bca12432e9b62d3a
85,Shorts,Hurley Lowrider 2.5'' Novelty Short,Hurley,38.99,Women,191621,21ed94ef324c9cc53dc939844d61db32
86,Tops & Tees,Allegra K Ladies Boat Neck Long Sleeve Pullover Shirt Top New,Allegra K,8.82,Women,1094,3aae4c426093271ef8675aaf87bc5f6b
87,Suits & Sport Coats,Gold Series Continuous Comfort Blazer,CasualMale,178,Men,437998,83bb86c609dedde59eb64e181b043a90
88,Dresses,Ball Gown Strapless Formal Prom Wedding Dress #2714,US Fairytailes,259.99,Women,86186,0cd9e4e743a31b86f5ef67d4ea9d622a
89,Skirts,American Apparel Illustrated Chiffon Double-Layered Shirred Waist Skirt,American Apparel,42,Women,240677,84704f524a69bfe0e1b7a3f60ae57366
90,Tops & Tees,Seven7 Women's Back V-Neck Dolman Top,Seven7,44,Women,62305,317a753c7020741da199ba1ad6d9841c
91,Socks,Volcom Men's Argyle Socks,,22.48,Men,100011,7aac40579bea5d159f9086bb16e89da0
92,Accessories,Saddleback Leather Bi-fold Wallet Small,Saddleback Leather Co.,47,Men,30308,f09b0b960f5fd87b28de0fdca45f72d3
93,Leggings,New Solid Harem Parachute Balloon Low Inseam Pants Leggings Stretch Tights Brown,SK Hat shop,9.95,Women,312755,d7a97ecd582667c7b1cc20f09d143d69
94,Accessories,Kenneth Cole REACTION Men's Money Clip With Id Window,Kenneth Cole REACTION,17.99,Men,6401,a3ea69eba6c1abe0d8f1108ace4bafc9
95,Leggings,American Apparel Tie Dye Cotton Spandex Jersey Legging,American Apparel,34,Women,350704,a2e244e6c9702a4177846eb8c00c930f
96,Intimates,Wacoal Women's Seduction Boy Leg Panty,Wacoal,28,Women,23557,a9e2fc4125b0eb5d53fe44dec4e7fef6
97,Sweaters,Hi-Tec Women's Hanks Canyon Hooded Vest,Hi-Tec,100,Women,17560,d2d0e54c2974d34a24d959326de1b42d
98,Active,Nike Men's No Show Moisture Management Socks 3 pack,Nike,18.99,Men,5524,8af98168970c526ed4e3fc936e373183
99,Accessories,Isotoner Men's Acrylic Knit Palm Gloves,Isotoner,16,Men,10318,e480d58feae003a4a9489d905f4b9fba
100,Tops & Tees,Women's Pleated Standard Collar Tuxedo Shirt,Tuxedo Park,14.5,Women,60774,d4cdbc0fcc1caa30a2ae232e2746cb7c
101,Jeans,Not Your Daughter's Jeans Women's Petite Loretta Ankle Jean,Not Your Daughter's Jeans,110,Women,36290,1671e580da1f9079184be3e5ae66b12f
102,Tops & Tees,ililily Simple Basic 100% Cotton Baseball 3/4 raglan sleeve T-shirt for Men (tshirts-008),ililily,9.99,Men,10574,b59706efd0aad13ed9af56a2dfd0a297
103,Outerwear & Coats,Women's Guide Gear Snowflake Jacket,Guide Gear,79.99,Women,174521,8868009c2b5ad745b3be349c2b4c32bf
104,Leggings,Mod Squares Footless Leggings,Paper Magic,12.66,Women,224272,097f64d780b004c7663aab7d2fded3bc
105,Active,Darn Tough Vermont Merino Wool Micro Crew Cushion Sock,Darn Tough,37.95,Men,2587,444735db85c9191bfe4b5cf2de71a44b
106,Leggings,bebe Four Zipper Legging,bebe,79,Women,338255,04a9849ad7c812dd8fe3126cb3570053
107,Jeans,Levi's Men's 510 Super Skinny Jean,Levi's,44.99,Men,353,ffb616a3fd52c641dc871de51d5ebc52
108,Sweaters,Mens Lambswool V Neck Cardigan,Wool Overs,39,Men,36879,c07fab20fc075e3a861cfd0db3defa52
109,Sweaters,VANCL Men V-Neck Premium Wool Sweater,VANCL,29.9,Men,193002,820678f6d09e90d66cb60142e613408b
110,Clothing Sets,Scrunch Cloth Pants Set / Jacket - Regular,Orvis,69,Women,992984,dc3391ba526c933ce772035f8b4928d1
111,Socks,Sock It To Me FISH Mens Crew Socks,Sock It To Me,7.5,Men,122988,3dc389405e7f84fcd014257f844a322d
112,Plus,DG26 Style 3 DG Eyewear Designer Vintage Oversized Women's Sunglasses,DG Eyewear,3.99,Women,1872,21d463534e990b10afe78755f4a40d37
113,Underwear,2(x)ist Men's Xtreme Range No Show Brief,2(x)ist,28,Men,54502,fb9bb402b1648e46f3a0b97e38a95825
114,Jumpsuits & Rompers,Allegra K Lady Slant Pockets Floral Spaghetti Romper Jumpsuit XS,Allegra K,12.37,Women,1497748,44d35d13ca4abcf4084bf0e60bb15b86
115,Skirts,2B Tropical Stripe Pencil Skirt,2b by bebe,29.95,Women,278823,dd001afc55838c38a725252b60d1ff5a
116,Suits,Suit Studio Garden Grove Skirt Suit,Suit Studio,69.98,Women,440074,4733fac26f04a102a576d99dcc6e9845
117,Tops & Tees,Columbia Men's Elm Creek Polo,Columbia,45,Men,51337,e7e999685ba4bc0cc802fc80369333e5
118,Outerwear & Coats,Carhartt Women's Sandstone Quilt Flannel Lined Active Jacket,Carhartt,105,Women,545,abcb907fd639ac13523f957a18a26617
119,Sleep & Lounge,Silk Boxer Shorts for Women - Assorted 3-Pack - XS-XL - Silk Boxers Set,Royal Silk,50,Women,122184,b08c4cf24a65fa8e13c1cfa81650018d
120,Socks & Hosiery,Calvin Klein Women's Non Elastic Comfort Top Crew,Calvin Klein,10,Women,52025,402d795355ddf05bd76751a4fd6a43a5
121,Sweaters,Pendleton Men's Jacquard Cardigan,Pendleton,148,Men,178867,e6e159b530d9c86c14987e4bba3041bf
122,Clothing Sets,"N.G.U. Designs 2 piece jacket long skirt, spilt up the front with studs",N.G.U.,120,Women,1663097,e9122bdfdb70f46ba1dca6f29e1849f8
123,Skirts,Camouflage Mini Skirt Woodland Camo Skirt,ANS,13.5,Women,187324,965e8ef0de736460ee821d459586a8f2
124,Underwear,Diesel Men's Randal Tee,Diesel,39,Men,43490,15eae44594240a822d3ce7f554e671eb
125,Intimates,Glamorise Women's Wonderwire Seamless Molded Support Bra #9195,Jessica London,46.99,Women,28501,736938781370def908e110defe488b94
126,Dresses,One-size-fits-most Tube Dress/Coverup - Field Of Flowers (many colors),Alki'i,19.99,Women,63302,da38352764ba250cfa027ba7ff4e849f
127,Sleep & Lounge,HUGO BOSS Men's Stripe Short Pant,HUGO BOSS,39,Men,340280,a3d5982742269ef2f11d21efba2a329e
128,Socks,Sock It To Me Yellow Black Mustache Pattern Mens Dress Sock,Sock It To Me,9,Men,144186,bca8930aac34fa62b19cdbddacc855c4
129,Shorts,Men's Polo Ralph Lauren Tyler Plaid Red Gray Blue Green Shorts 1396441 BR,Ralph Lauren,43.97,Men,434743,2db450c608239b21d7095af2869f6671
130,Swim,Speedo Womens Xtra Life Lycra Optic Splice Tankini Set With Hydro Bra,Speedo,72,Women,38732,0dc349765065ee55c9e6df12cfe98534
131,Plus,Hanes Sport Women's Crew Socks 6 Pack # 417/6,Hanes,10.58,Women,5217,be44f0e671a8200fb2d2fd6249a6e04a
132,Intimates,Lace Garter Belt Babydoll Set-Black,SEX NIGHT,24,Women,1333379,05a434c8ea095d1dbc6594c2aaf2141d
133,Jeans,Levi's Women's 515 Cuffed Capri Jean,Levi's,26.82,Women,39467,73cc536b68db36862171ac4e5b456f9b
134,Jeans,AG Adriano Goldschmied Men's Matchbox Slim Tonal Stitch Straight Jean,AG Adriano Goldschmied,188,Men,146923,a133fe85a4c45460c3b15346be851087
135,Swim,ALPINESTARS Men's Racer Boardshorts,Alpinestars,56.95,Men,475201,7ee154934ede375e22f8812a49acc8a3
136,Accessories,Nice Shades Black One Size Canvas Military Web Belt With Black Slider Buckle. Many Colors Available 56'',Nice Shades,3,Men,3403,778f9781629a9da54b8cad7e16389a8c
137,Pants,Haggar Men's Standard Khaki Plain Front Chino Casual Pant,Haggar,34.99,Men,95673,6bece56d171aaa6d1cc846cd07a7b155
138,Skirts,Robert Rodriguez Women's Pencil Skirt,Robert Rodriguez,465,Women,228206,eb577d990796736261823ecff40a9902
139,Jeans,Genuine Wrangler Men's Loose Fit Jeans,Wrangler,40,Men,4023,f01fd6bf9cf859165ca80590536ccc93
140,Swim,ATHENA Women's Heavenly Bandeau Bra,Athena,61,Women,124263,6cfb1d6e3a60974809111531f98ff3b1
141,Swim,Rip Curl Wetsuits Men's Mirage Grid Lock Short,Rip Curl,53.48,Men,148989,0ecf1efaab8df98b118c2226cb334b8f
142,Jeans,Nautica Jeans Men's Loose Dark Rinse Jean,Nautica,39.95,Men,7863,d984a9b368a5b006112c75d05aee1162
143,Underwear,Bjorn Borg Men's Boxer Brief,Bjorn Borg,25,Men,86001,a0836596efba8f453973ba3ea3f1b92a
144,Blazers & Jackets,KAMALIKULTURE Women's Single Breasted Blazer,KAMALIKULTURE,78,Women,58601,175760300c16f4518260f50b38728cd4
145,Active,Horny Toad Men's Hangover Pant,Horny Toad,87.95,Men,30212,761c50dc6e288af6f32fa3abec72cf5e
146,Shorts,DC Men's Straight Chino Walkshort,DC,45,Men,266354,023c468f0d9053e2e987807ecc221ce4
147,Active,Tri-Mountain Men's Stretch Mock Turtleneck T-Shirt. 620,Tri-Mountain,38.99,Men,5656,14f07049a625b2ee13a8f379ecbd1a53
148,Underwear,Saxx Men's Luxury Boxer Fly Brief,Saxx,33,Men,26805,b0f71a3516f7d8f4c388b6a8f6e3aff1
149,Jeans,WeSC Alessandro Slim Denim Pant - Men's,WESC,69.95,Men,100511,b0d76d1ca21b2778e70315a3a8d80bb9
150,Tops & Tees,Ecko Mens Graphic Tee T-Shirt - Style 90409,Marc Ecko,19.99,Men,115618,952cb319aade255b66df42673612c3a2
151,Plus,Ivory Hand Made Knit Headband With Flower Detail,Luxury Divas,8,Women,1181,907258cbf91672098119ec4d1d9bebdc
152,Swim,Quiksilver Men's Biarritz Dip Board Short,Quiksilver,62,Men,226853,f1dc0a1c1d0055de7ec65613b8c0dec7
153,Pants,Dickies 1953 Painter's Pants (White;30W x 30L),Dickies,21.64,Men,263842,743964c4ca6a1b8d393fb639a7326338
154,Sleep & Lounge,Monk Luxury Style Hooded Full Ankle Length Double Sided Heavy Turkish Terry Cotton Bathrobe,Bathrobes Online,134.5,Men,11698,ba3eac8754c298f954e914097f5014d1
155,Accessories,Oakley Women's Necessity Round Sunglasses,Oakley,110.5,Women,64005,e53b84d3618fed6e61eb39e35a1f2092
156,Suits & Sport Coats,DKNY Mens 2 Button Gray Plaid Slim Fit Wool Sport Coat Jacket,DKNY,99.99,Men,45083,7cab4f278cffcfb43c5881a04b76c6de
157,Intimates,David's Bridal Plus Size Full Bridal Gown Slip Style 9795W,David's Bridal,59,Women,871768,da2caa8599295663bfe23ea00c01e797
158,Fashion Hoodies & Sweatshirts,DC Women's Neighbor Pullover Sweater,DC,48,Women,125854,554081adef9b3ae8116c92ebd3b0b7ae
159,Pants & Capris,"Pants - Rayon, Elastic Waist - Amber Dragonflies",Curious Designs,26.95,Women,364574,6ff9096fbf58ffe0d2b4bae81941aba2
160,Shorts,Volcom Men's Frickin Modern Stretch Short,Volcom,49.5,Men,156401,27ef4b78e0b1364327e2986b0ac86641
161,Suits & Sport Coats,Scully Snap Front Italian Lamb Vest,Scully,149,Men,670275,44cb60279b1cf52dafe4ef40b9ea9c62
162,Swim,Oneill Men's Jordy Hybrid Boardshort,O'Neill,59.5,Men,215550,92e083dd611b243da667c0be5ab621f4
163,Swim,Island Outfitters Big & Tall Hibiscus Print Swim Trunks,Calvin Klein,40,Men,22103,593a4d0968279800a96c4e0d8b64b44c
164,Suits,NINE WEST Flared 3/4 Sleeve Jacket/Pant Suit-RED/MULTI-6,Nine West,169.99,Women,1559146,493d51e1432bffb7dfb4b75544352fc3
165,Sleep & Lounge,American Essentials Men's Sleepwear Woven Pant,American Essentials,45.17,Men,62880,5cb7f54db249e783ffaad12cad3e0227
166,Blazers & Jackets,Karen Kane Women's Shirred 3/4 Sleeve Drape Jacket,Karen Kane,79,Women,603451,7d42a76428edcb45344069bf6ff831ab
167,Pants,WeSC Men's Eddy Chino Pant,WESC,77,Men,104137,a44ef8cae3924f5f7ef1f54f7a42dba4
168,Outerwear & Coats,Dickies Men's Sanded Duck Sherpa Lined Jacket,Dickies,79.99,Men,61056,6eb347342d697cfb0c74b60fb9a20962
169,Tops & Tees,Eddie Bauer Favorite Long-Sleeve Crewneck T-Shirt,Eddie Bauer,27.95,Women,29633,6a255a4a0a54145ef0fa9613d2b23670
170,Suits & Sport Coats,Tasso Elba Mens Double Breasted Gray Herringbone Wool Sport Coat Jacket,Tasso Elba,99.99,Men,66485,c3f7b2b30030699119ce59db7d87c93d
171,Blazers & Jackets,Allegra K Ladies Front Opening Medium Sleeve Lace Patchwork Blazer White XS,Allegra K,10.9,Women,922161,67fa8e5c502cefb36bbf0b93a12a315e
172,Clothing Sets,Women's Embroidered Career Set by BBW Boutique - in your choice of color,BBW Boutique,69.99,Women,1187200,3805e3748f6e5f8f5892cef7794c099e
173,Sleep & Lounge,Pendleton Men's Lounge Robe,Pendleton,84,Men,153639,25be6b89a80f023926b6e70abcd3d9c4
174,Maternity,Ripe Maternity Women's Tiffany Dress,Ripe Maternity,46,Women,177285,7e6b6c5a2fff1d32e6bbc3b6728ad5c4
175,Fashion Hoodies & Sweatshirts,Calvin Klein Sportswear Men's Long Sleeve Space Dye Hoodie,Calvin Klein,98,Men,326339,5c5abf71539978670c4bc89687767a7c
176,Accessories,Persol Men's 0PO0714 Square Polarized Sunglasses,Persol,169.5,Men,4064,d3ba13cb70376a29df62f904a32c7da3
177,Active,Moving Comfort Women's Fiona Bra,Moving Comfort,48.98,Women,85,cd83fdc147605e7927713425f8ec986d
178,Accessories,Kenneth Cole REACTION Men's Money Clip,Kenneth Cole REACTION,28.32,Men,6040,714743dbf02af0a896e28bb255febf7a
179,Swim,Carve Women's St.Barth Bottom,Carve Designs,41.95,Women,214122,c6eeedf70eb566a3241dace5c31dd907
180,Intimates,Shadowline Snip-it Slip 28'' Slip (1302),Shadowline,24.5,Women,35743,e4dc705db9f4357fe7a48d75305a4bc5
181,Swim,Inches Off Plus Size Swimsuit with colorblocking,Inches Off,49.99,Women,4473,d2bb23c64a449913d0f71aa66bbaced9
182,Socks & Hosiery,Hanes Women's Control Top Reinforced Toe Silk Reflections Panty Hose,Hanes,25.5,Women,655,ad5fc8ce8be73a61f2fc7957ad766eae
183,Suits,Anne Klein Classic Fit Urban Gem Skirt Suit Onyx Multi,Anne Klein,169.99,Women,205511,28de6fedc630d762d6747570c2eb1028
184,Pants & Capris,Pendleton Women's Plus-Size Travel Tricotine Destination Pant,Pendleton,38.98,Women,36432,0d3e1a95fbeb4eb0792a84df64183807
185,Skirts,2B Metallic Lace Skirt,2b by bebe,29.95,Women,315517,92157a6e332dc11eca389f6bec385e19
186,Pants,Allegra K Mens Casual 2012 NEW Side Pockets Straight Trousers Pants Light Gray W31,Allegra K,15.33,Men,2050,03793f13398b35fa7bea92ce27f8f114
187,Shorts,Southpole Men's Big & Tall Basic Flat Front Twill Short,Southpole,25,Men,147789,278e36b759c3f7f5e592e08cac0181de
188,Tops & Tees,FEA Juniors Hunger Games Movie Fire Mockingjay Tissue Tee,FEA,39.95,Women,37014,4cbf0415217b76fee81e692b372c6bcb
189,Accessories,Seirus Innovation Men's Original All Weather Glove,Seirus Innovation,25.94,Men,20371,243a4db06702f3bdc655d3d6c7608ccc
190,Shorts,KUT from the Kloth Women's Bermuda Trouser Short,KUT from the Kloth,65,Women,328478,4bd373930484738f59e4fed404226205
191,Tops & Tees,Harley-Davidson? Men's Bar & Shield T-Shirt. Black. House of Harley Graphics on Back 302905920,Harley-Davidson,28.95,Men,9288,701070b6bad46d7a68f1e8417b9444c8
192,Accessories,Ray-Ban 0RB3491 Aviator Sunglasses,Ray-Ban,85,Men,29986,4280d40c46046c561c9eadc72ee8223c
193,Outerwear & Coats,Charcoal White Ladies Jersey Letterman A Jacket,FineBrandShop,32.9,Women,6149,5d90f1414101ba024be6efa69b1dc899
194,Fashion Hoodies & Sweatshirts,I Heart Irish Dance Clover Hoodie,Activewear Apparel,36.99,Women,608314,8f48bdf950e1496ddfde100920db9664
195,Outerwear & Coats,London Fog Women's Single-Breasted Raincoat,London Fog,157.5,Women,151531,32cd7f6cfb10cbc1f7c9b5f7345c45dd
196,Pants & Capris,Allegra K Women Drawstring Waist Solid Color Casual Loose Pants Black XS,Allegra K,10.64,Women,223281,ccd124e952d7b3bb736bdfbe97f36738
197,Swim,Gotcha Men's Solid Plaid Fade Boardshort,Gotcha,25,Men,156347,086eccd07b8622681234772caa6167c7
198,Pants,Dockers Men's Limited Offer D1 Slim Fit Sateen Khaki Pant,Dockers,49.99,Men,32556,8c0eec3ee4513a90a326f5a144685cb0
199,Tops & Tees,RIGGS WORKWEAR by Wrangler Men's Logger Shirt,Wrangler,28.99,Men,2673,fc4de971ea3178267f2af2b9a2a259a2
200,Jeans,Dickies Women's Slim Boot Cut Jean,Dickies,40.84,Women,30161,d7a395ff510e81859615784ec21e40d8
201,Shorts,Lucky Brand Women's Riley Frayed Printed Short,Lucky Brand,25,Women,84866,8fe13f3a68f23fa39928941b64c6a25e
202,Socks,point6 Hiking Tech Medium Cushion Crew Socks,point6,19.95,Men,69568,d2f5c2f72db24ee018e4e0a2ccc407de
203,Accessories,Touchpoint Women's Basic Fleece Touchpoint Glove,Touchpoint,16,Women,23868,66b4c5eed1de84748c19b34b9015c56c
204,Suits,Suit Studio Sunset Boulevard Skirt Suit,Suit Studio,72.78,Women,1653573,f01b491add952e104559b6caa9d54792
