id,category,item_name,brand,retail_price,department,rank,sku
205,Tops & Tees,Metal Mulisha Men's Expand Tank,Metal Mulisha,24,Men,80242,422af425737655b10330f29e78cc3bac
206,Skirts,Kelly Nishimoto Yellow Plaid Skirt,Kelly Nishimoto,79,Women,436792,05363a7d5bf289803612d8b9d188ffc4
207,Socks & Hosiery,Gold Toe Women's 3-Pack Flat Knit Liner Athletic Sock,Gold Toe,10,Women,24010,1bfa9d5a6888e6274f5bd6b6d6b334e0
208,Swim,Nautica Men's Diamond Sailstitch Boardshort,Nautica,49.5,Men,42027,ac20487cf823832ea79f5613d319f50f
209,Jeans,Joe's Jeans Women's Flynn Skinny,Joe's Jeans,169,Women,183069,37942b5e0a47f8f2364d703f4ac7586b
210,Shorts,7 For All Mankind Women's Cut off Short in White,7 For All Mankind,154,Women,683406,18d9b0e25a3b5285a70486fe6d17dc85
211,Accessories,SethRoberts-Classic Cashmere Feel Men's Winter Scarf in Rich Plaids,SethRoberts,18,Men,37978,1ca120248671a010fafda5b6e736156b
212,Accessories,SUSPENDER BOXED CLIP,boxed-gifts,11.99,Men,11004,1a4729920aa58b4b3757721249a40f5c
213,Accessories,Carhartt Women's Dearborn Belt,Carhartt,30,Women,3388,6c9a3d57261f8091042bca376d8e3ecf
214,Plus,Mundi Big Fat Wallet,Mundi,21.99,Women,2954,32a0267c452fe6960e0dfde47a46f3dc
215,Shorts,Columbia Sportswear Sandy River II Print Shorts - UPF 30 (For Women) - HARLEQUIN SWIRL,Columbia,24,Women,1525373,e60e1edd2759d772d6b2a757f32155c2
216,Jeans,True Religion Men's Bobby Phoenix Straight Jean,True Religion,227,Men,93219,19fe9bcb20c269cd030a7ba03b67c0f2
217,Jeans,True Religion Men's Ricky Zip-Fly Straight Jean,True Religion,163.64,Men,19520,fe39634591b25fb1bddcb151e1e15142
218,Outerwear & Coats,Diesel Men's Lagnum Leather Jacket,Diesel,598,Men,163383,9c39f7f644c62df70a1ed2602e6f5f1a
219,Sleep & Lounge,Bottoms Out Men's Knit Sleep Jam,Bottoms Out,11.99,Men,102173,42de467f4f26ea4b570408fec562a4d6
220,Jeans,Wrangler Men's Big Rugged Wear Stretch Jean,Wrangler,66.13,Men,75003,834a9c00445f11c590d020c519293473
221,Underwear,HUGO BOSS Men's 3 Pack Traditional Brief,HUGO BOSS,24.5,Men,3070,19ba4ca5354072935f01121bec7c3136
222,Pants,Haggar Mens Cool 18 Gabardine Pleat Front Pant,Haggar,65,Men,2279,6ce9bc1f260352ba5331e218b4fa5ab6
223,Outerwear & Coats,Ladies Brown Synthetic Hooded Leather Jacket,FineBrandShop,41,Women,21049,e53c9d04c5cbc2c50e70244823f63872
224,Shorts,Savane Big Mens Twill Utility Cargo Short,Savane,22.88,Men,486726,df4f6737b9ebd9eb3f7df29ef030d875
225,Swim,Swim 365 Plus Size Solid blouson swimsuit top,Swim 365,59.99,Women,510819,88af5fef065b14c13c7aadbdb47ec280
226,Tops & Tees,American Sons - Sons Of Anarchy T-shirt,Sons Of Anarchy,23.99,Men,22322,e8d361f20e8b07ed873e17ce50f4b3a2
227,Skirts,Red Fold-Over Maxi Jersey Skirt,FineBrandShop,18.95,Women,11484,edbf104e34fbf60a453dec070be2ae48
228,Jeans,True Religion Men's Ricky Straight Leg Jean,True Religion,242,Men,113156,26c5d4f29e5a49b72e4f9cf795999b88
229,Active,Moving Comfort Women's Flow Regular Pant,Moving Comfort,68,Women,9181,4a91be01c6e19ee08e9813ded39c11ec
230,Underwear,Duofold Men's Expedition Weight Two-Layer Thermal Tagless Bottom,Duofold,45.95,Men,1369,cc8eedd0e5b2119f9882225937d5b0f2
231,Accessories,Saddleback Leather Bi-fold Wallet Medium,Saddleback Leather Co.,50,Men,5333,06dd501346b9ae2f0526fa13c6f4f3b1
232,Fashion Hoodies & Sweatshirts,RETROFIT Bar None Mens Hooded Sweater,Retrofit,34.99,Men,236332,0cbd46205af818e277d050c33b716a47
233,Tops & Tees,Harley-Davidson? Women's 110th Anniversary Logo Short Sleeve T-Shirt. Black. Graphics. All Cotton. 302917620,Harley-Davidson,36.5,Women,139391,3f7ce9e760935c819e51884dd102988e
234,Socks,Stance Lizard King Socks - Men's,Stance,11.99,Men,81593,cafc1a7ece6b70f47c3ea37cf8bb4760
235,Active,2XU Men's Elite Compression Long Sleeve Top,2XU,107.52,Men,36588,ac704b897540b82f8ce1e8109b6231b4
236,Active,Eurosocks Patented Recovery Graduated Compression Sock,Eurosock,35,Men,5115,777e775b952bf8b0399432d55b031ae9
237,Suits & Sport Coats,Paul Fredrick Trim Fit Twill Weave Two-Button Suit Jacket,Paul Fredrick,219.5,Men,643741,de3489d71cf516d794c54948201fb5f3
238,Pants & Capris,Drawstring Capri Pants - Misses' Sizes,Carol Wright Gifts,9.99,Women,174603,5cb349d86f7917b1f9cc67a40353596b
239,Sleep & Lounge,Pookies ''Platinum Dreamliner'' Print,DFDesigns,25.5,Men,143638,27ff8f3180611b2c2e9d2f74e2079d41
240,Tops & Tees,Bella Ladies 6.5 oz. Cotton/Spandex Camisole - WHITE - S,Bella,15.3,Women,49505,b1b4f78ca8d486de9f550a8cff88a5f9
241,Pants & Capris,Levi's Women's Mid Rise Styled Skinny Slim Fit Pant,Levi's,43.99,Women,135879,a5755938b2144101084d7c17978157e0
242,Jeans,7 For All Mankind Women's Kimmie Bootcut Jean,7 For All Mankind,189,Women,141206,d6b8e36f3e3444a3d4c2d13fea73f3d2
243,Sweaters,Schaefer Mesquite Vest,Schaefer Outfitters,80,Men,282931,08aa568b60e7b2416cbd64273c70504b
244,Fashion Hoodies & Sweatshirts,American Apparel Polka Dot Flex Fleece Zip Hoodie,American Apparel,44,Men,64956,c0f53edf708fd336162820d5eec5e015
245,Dresses,Collections Etc - Versatile Black A Line Long Sleeve Dress,Samanthas Style Shoppe,34.97,Women,33364,683d5d79c4e94d9123fd352ec95fc66b
246,Shorts,Cubavera Men's Flat Front Linen Blend Herringbone Texture Cargo Short,Cubavera,38.5,Men,65984,c3b83afa310385da031e8813df71fab1
247,Shorts,BCBGeneration Women's Lace Trim Short,BCBGeneration,43.76,Women,171386,693caef473118cbcf01881de61afcbd5
248,Sleep & Lounge,Eileen West Women's Evening Star Ballet Nightgown,Eileen West,64,Women,144978,becc906683a2bd22e01f3cf24f53ca4f
249,Jeans,Mavi Women's Molly Bootcut,Mavi,98,Women,82483,d4bfe86b22505a9f6daf2c8c252e48c5
250,Sleep & Lounge,Katnap Pink Skull Footed Pajama Pants for Women,Katnap,11.99,Women,122958,3c7933ac41540ec5590fb514f3cf34d0
251,Tops & Tees,Ralph Lauren Sport Women V-neck Pima Cotton Striped T-shirt,Ralph Lauren,29.99,Women,69024,6ee587ddb0b491309d333d865568a32c
252,Leggings,American Apparel Youth Patterned Polyester Spandex Legging,American Apparel,25,Women,455564,8350a97c200abc94ac30c7b621ff59d0
253,Accessories,Elegant Leopard Animal Print Scarf with Fringe - Different Colors Available,TrendsBlue,8.99,Women,1281,b16742b2d199ac1725ca8214098dbe6f
254,Suits,ICE (2327) smart stretch pencil skirt + FREE belt black size 6-14,Ice,21.99,Women,208076,512fc95ba059a9135a1714e4a521ad7b
255,Accessories,Columbia Men's 35mm Genuine Reversible Leather Laced Belt,Columbia,19.99,Men,7656,10c738b814fa7968588cab8cbcb00ec4
256,Sleep & Lounge,Red or Royal Blue Soft Fleece Robe Bathrobe Gift Item,Ms. Maggie,19.49,Women,79658,d4a74a9534570a37471248c9e31733a1
257,Active,Misses Fleece Lined Zip Front Hooded Sweatshirt,LabelShopper,13.99,Women,69316,2b974fa92884bc3896d3942e1bf74184
258,Outerwear & Coats,Larry Levine Women's Maxi Length Down Coat,Larry Levine,112.5,Women,40841,e4a325972c0907817a7b825893f8cb2c
259,Shorts,Brixton Men's Toil Short,Brixton,39,Men,552987,c1d73a1fcca0dd74529e2a6ee94c2b99
260,Outerwear & Coats,Nautica Women's Zip Out Anorak,Nautica,63.33,Women,65864,9c428f6ab81be57bcb2f248550f17ce8
261,Tops & Tees,Fred Perry Men's Concealed Twin Tip End On,Fred Perry,125,Men,36653,fd252ecd80f2bb6183c21804465b1f5a
262,Swim,O'Neill Party Pack Boardshort (1106302A),O'Neill,49.5,Men,390945,de8d1ff0f32ab32064622996f970cf93
263,Sleep & Lounge,Jockey? Knit Sleep Pant,Jockey,36,Women,58889,2c55c14f12e14080670e4dd8643e6032
264,Active,ASICS Men's Team Medley Tight,ASICS,34.19,Men,4308,3c937b54c2c7c32502dee66d46ec5cde
265,Clothing Sets,Kasper Eternal City Pant Suit,Kasper,147.13,Women,973670,d59d62dc5b57cb65ff8221a36841c156
266,Accessories,Polo Ralph Lauren Pony Logo Hat Cap Pink with Navy pony,Polo Ralph Lauren,33.98,Women,14976,8563abcc55f8c18a1065df09507403e1
267,Sleep & Lounge,Bottoms Out Men's Flannel Sleep Pant,Bottoms Out,25,Men,113668,b6958f406742251dd2a4797728426b67
268,Swim,Gotcha Men's Zig Zag Boardshort,Gotcha,25,Men,74946,1a38f98225e8414b3150f587d09ebfd2
269,Sleep & Lounge,"Red and Black Plaid Check Flannel Cotton Girl Boxers Mini Itty Bitty Shorts 1'' Inseam, Covered elastic waist, 100% cotton,",Touch of Europe Boxers,12.99,Women,69234,9f271fb53bb137ca92f60e91f61e0755
270,Suits & Sport Coats,GUESS by Marciano Woven Blazer,GUESS by Marciano,328,Men,688256,89ef53c4a515da7beb041fd31f0fab84
271,Sweaters,Canterbury of New Zealand Men's Todd Pigment Sweater,Canterbury of New Zealand,62.7,Men,101945,2e7247c33ca35c9d6ee0990132b2add0
272,Fashion Hoodies & Sweatshirts,Allegra K Lady Pink Long Sleeve Kangaroo Pocket Pullover Coat XS,Allegra K,13.51,Women,17932,50843b7633c68435f9c87c3cc9d3ea50
273,Skirts,Eileen Fisher Black Tropical Bi-Stretch Knee Length Pencil Skirt,Eileen Fisher,99.99,Women,714267,32b0f4af26aee31ce03a97bf219a865a
274,Socks & Hosiery,Gold Toe Women's Fashion Pack B,Gold Toe,15,Women,858,6e032744cd0f99aaa472d7cd3f29a1b9
275,Tops & Tees,Carhartt Women's Midweight Flannel Button Front Shirt,Carhartt,44.95,Women,7528,640bab0af3ebe85664aacd598e61873f
276,Sleep & Lounge,Munki Munki Women's Classic Flannel Pajama Set With Elastic Waistband Pants,Munki Munki,88,Women,160513,14e16accb5ead2165a40918046113f7a
277,Swim,Miraclesuit Happy Place Women's Plus Swimsuit 82049W,Miraclesuit,145,Women,426192,12664f891e506a4d73fd4de005111566
278,Jeans,PAIGE Women's Skyline Skinny Jean,PAIGE,158,Women,96127,f651e855b29134a5ef4eb34c03374090
279,Sweaters,Port Authority Men's Big Interlock Knit Turtleneck - Black - Large [Apparel],Port Authority,21.87,Men,67661,d8fde70a97c6f8d9ed2775a00332f2ca
280,Swim,Quiksilver Men's Overboard Amphibian Short,Quiksilver,55,Men,16014,989d6c41e57ba422f73bb235d03b1f41
281,Suits & Sport Coats,Haggar Men's 2 Button Textured Herringbone Center Vent Sport Coat,Haggar,99.99,Men,11252,8e949b200c4df02d5867e1c9fd60d063
282,Skirts,White Fold-Over Maxi Jersey Skirt,FineBrandShop,15.9,Women,13143,bfe8fc8d441c3952d90625dc6d05994a
283,Sweaters,Joe Browns Men's Fishermans Cable Crew Sweater,Joe Browns,81,Men,222188,f4e036526613400e013b18f9c25052d6
284,Pants,Perry Ellis Men's Portfolio Modern Fit Flat Front Solid Bengaline Pant,Perry Ellis,49.99,Men,2301,bc767d52653ab5bb8bdca720388d481b
285,Socks & Hosiery,Thorlo Women's Lite Running Mini Ankle-Cut Sock,Thorlo,44.99,Women,11330,aaa45bd76f58a7d14503d70d29f19869
286,Pants,Perry Ellis Men's Portfolio Solid Herringbone Flat Front Dress Pant,Perry Ellis,37.5,Men,23132,b9d52e8b9aea1bcd1d144e3108fe4cac
287,Accessories,Scarf_tradinginc Elegant Paisley Jacquard Pashmina Scarf Wrap Stole **Multiple colors**,Scarf_tradinginc,12.99,Women,654,df73b3dee75e83a15370053fead20128
288,Jeans,Vigoss Juniors Super Skinny Soho Jean,Vigoss,25,Women,24292,e708119309bc8bb0467a3f8eb5c52fbb
289,Sweaters,Mens Argyle Print Sweater,LabelShopper,19.99,Men,103525,7ffb4718dcd55d720c1ba4836466835c
290,Plus,Turtle Fur The Turtle's Neckwarmer,Turtle Fur,8.95,Women,180,b48300ace9fbaa93ead33bd2e237ac0d
291,Socks & Hosiery,Roxy Cruiser Sock - 2-Pack - Women's,Roxy,11.95,Women,127026,bf895c1c6f8ebfb13e139fccfcf6b30a
292,Sleep & Lounge,Bathrobes Online Mens and Womens Double Sided 100% Turkish Terry Cotton Shawl Collar Bathrobe,Bathrobes Online,69.95,Men,19655,325ad6c6d3401e6a887f653cbff69511
293,Outerwear & Coats,Kuhl Sovana 1/4 Zip - Womens,Kuhl,119.95,Women,35046,97ffd9b904072c27190ba2ac81e1ab31
294,Active,Pearl iZUMi Attack Sock 3-Pack,Pearl iZUMi,23.23,Men,3088,daeaaea4924829e17eb62e2017265323
295,Suits,(6249-3) Teddy Style Function Suit with Pencil Skirt Grey,Ice,75.99,Women,656656,2dccd95c6f25220d9947c22754baecb7
296,Active,Under Armour Men's The Original Fitted Crew,Under Armour,29.9,Men,8718,37c4b91cc3aa2faafa6602eeffc287d8
297,Swim,TYR Sport Women's Solid Maxback Swim Suit,TYR,59.95,Women,4476,611e7efe5946acf8b888e615cb45cc0b
298,Tops & Tees,Billabong - Billabong Tee - BBR,Billabong,32.5,Men,72819,f35b966df9fba89fca309a76fde8b9e2
299,Jeans,"Diesel Men's Larkee Relaxed Straight Leg Jean, Denim, 32x32",Diesel,93.98,Men,29564,109693f78baef87351a790afa3d87ea0
300,Sweaters,Sweater - Corporate Twin Set,Edwards Garment,59.95,Women,52345,3ac4f05f565eecddbbc0b3d53578b3f4
301,Pants & Capris,Ed Garments Women's Waistband Flat Front Pant. 8759,Ed Garments,60.99,Women,234369,35e8af4e367efa9da60e6425713f1342
302,Sweaters,Alex Cannon Men's Multi Stripe Sweater,Alex Cannon,69.99,Men,176515,31b6d28a34c4a804fcf625f7007d0ea5
303,Suits & Sport Coats,Tallia Mens 2 Button Flat Front Solid Gray Sharkskin Suit,Tallia,89.99,Men,352857,19736d49fb29c92e54c896ab5daf9048
304,Sweaters,Kenneth Cole Men's Stripe V-Neck Sweater,Kenneth Cole,54.99,Men,20025,3c71be6cfe516e2fc87f633984356ec6
305,Outerwear & Coats,RUDE Black Denim Houndstooth Hooded Vest,Hot Topic,39.5,Men,42855,fb7f3a89be3f96ec5b468f2ac1afd6f4
306,Dresses,Curve Appeal Solid Ribbed Sweater Dress with Belt,Curve Appeal,16.99,Women,12278,8cb80033ffbd2165eadddb1e7a735501
307,Pants,Dockers Men's Easy D3 Classic Fit Pleated Khaki Pant,Dockers,50,Men,521,7b8965786fa2320a647548f1de4d48ac
308,Sweaters,Nautica Men's All Over Stripe V-Neck Sweater,Nautica,37.74,Men,80116,023722a1ff96f1d9987d89bb4d72b5b7
309,Fashion Hoodies & Sweatshirts,TITLE Knock Out Breast Cancer Zip-Up Women's Hoody,Title Boxing,29.99,Women,54888,f9104d51e58c98dfc1e509530a8e08c4
310,Tops & Tees,"RUM HAM It's Always Sunny In Philadelphia T-Shirt,",Always Sunny In Philadelphia,19.95,Men,76725,3fbe916f8403a0eb941d176116930ae3
311,Skirts,Karen Kane Women's Zig Zag Pencil Skirt,Karen Kane,79,Women,523640,127efc42ad36b7214b097e02a281a40d
312,Jeans,7 For All Mankind Men's Classic Standard Straight Leg Jean In Blue Shade,7 For All Mankind,119,Men,94799,15a1522ccc269cd7ce6e52e925d27e98
313,Suits & Sport Coats,"Cohesive & Co. Men's Bourbon Blazer, Cream, Large",Cohesive,150,Men,207953,f458e831bb6465ddd7e5b03e381dfe0b
314,Socks,point6 Hiking Tech Light Cushion Mini Crew Socks,point6,17,Men,67781,a9c30c04f7f222105f378f496b7af2f6
315,Suits & Sport Coats,Economy Vest for Men,Edwards Garment,39.95,Men,113886,737a1a5db699693b6241e6f757ea1970
316,Accessories,Dockers Men's Leather Wardrobe Belt Set,Dockers,27.99,Men,49628,bdfc36b8f7e37f3c1e95cfacf0505d7f
317,Outerwear & Coats,MICHAEL Michael Kors Women's Tara,MICHAEL Michael Kors,125,Women,17936,0a68c64eca1ec47fac0b3f49364cd189
318,Jumpsuits & Rompers,Motel Winnie Jumpsuit,Motel,78,Women,1769487,d9eb0ab885d7dcfd5dce18a29a757174
319,Suits & Sport Coats,Tommy Hilfiger Men's Trim Fit Solid Vest,Tommy Hilfiger,44.94,Men,19113,e50698a8da1613f83c6a97d6fa5bea22
320,Outerwear & Coats,Columbia Women's Benton Springs Hoodie Jacket,Columbia,74.95,Women,4670,039c2847648c4da217a1b4aa52cf6c25
321,Fashion Hoodies & Sweatshirts,Fox Men's Vanish Pullover Sweater,Fox,49.5,Men,117455,f021157cf54f33f22713ab33810e3ea4
322,Swim,Quiksilver Men's Diamond Dobby ''Cypher Kanaka'' 21' Boardshorts-Red,Quiksilver,39.98,Men,296616,8ba510f400a9457b167d3c26275d8a6a
323,Jeans,True Religion Men's TRBJ Ricky Badlands Jean,True Religion,297,Men,201374,f1e8f4442e88214fed10519829a9c50b
324,Plus,Under Armour Igniter Pro Sport Sunglasses,Under Armour,94.99,Women,56163,9a7bfd9cd4333064ccfa17cf9c3aac00
325,Fashion Hoodies & Sweatshirts,Allegra K Women Batwing Sleeve Zip Up Front Loose Hoodie Coat Black S,Allegra K,16.38,Women,149996,f7b125240f6d8495615d02e445e16573
326,Sweaters,Allegra K Women V Neck Long Sleeve Over Hip Hearts Print Casual Stretchy White Knit Shirt S,Allegra K,13.19,Women,70150,d8cafb1c89e67840bee360122c46e9b4
327,Pants & Capris,Fresh Laundry Women's Tencel Pant,Fresh Laundry,87,Women,270429,132f5ce1a084993598b87864edf66e7b
328,Fashion Hoodies & Sweatshirts,RETROFIT Men's Metal Long Sleeve Striped Hooded Sweater Gray Blue,Retrofit,33.98,Men,161720,07888d517f67de055d9a0dd611e2982a
329,Jeans,Lee Women's Womens Plus Classic Fit Lucille Straight Leg Jean,Lee,27.9,Women,7403,1907e803158c5f28da7cdbed3345d7d2
330,Sweaters,"Fashion Victim, Ladies Long Sleeve Bolero Shrug, Cardigan, Bright Colors",Fashion Victim,19.99,Women,115396,618cf10ad011332b731072534bf3960b
331,Maternity,Three Seasons Maternity Women's Solid Drape Front Top,Three Seasons Maternity,25,Women,78167,fea7b54a1558042b148d809345731cb7
332,Suits & Sport Coats,Allegra K Mens 2012 Trendy Padded Shoulder Single Button Closure Patch Pockets Blazer Gray XS,Allegra K,22.3,Men,288084,1c7375283b28bfb7033e15f018f517ad
333,Outerwear & Coats,The North Face Apex Bionic Jacket - Men's,The North Face,903,Men,135439,18f85bf814ecc63c0ea03b69f22fa7a7
334,Skirts,BCBGeneration Women's Full Skirt,BCBGeneration,58,Women,24571,f8ed5eddfc2f861481a1bea78adff15c
335,Sleep & Lounge,Harbor Bay Big & Tall Check Flannel Lounge Pants,Harbor Bay,32,Men,403440,9cc69dfc7c397dbcab845f6402616247
336,Swim,Oneill Men's Fusion Boardshort,O'Neill,49.5,Men,154591,fc6e9fcb168a5cebbd227853129f59c7
337,Leggings,Lean Mean Legging by Hold Your Haunches 201,Hold Your Haunches,170.98,Women,143093,3b2b667ec1bdf7a348d26d06ca116876
338,Socks,Richer Poorer Men's Matador Cotton Socks,Richer Poorer,10.17,Men,98539,999f375f2b57c65db7b30be823d9f002
339,Outerwear & Coats,Laundry Women's Windbreaker Down,laundry by SHELLI SEGAL,112.5,Women,31900,97643281b0cea26cd52bb4fadf419802
340,Pants,Mountain Khakis Men's Teton Twill Pant,Mountain Khakis,82.95,Men,3578,78aaeff32fd6a7fe6fe59df0ed99f20b
341,Jeans,Lucky Brand Women's Stark Sweet N Low Jean,Lucky Brand,79.5,Women,15069,9e397bf4ae27eb37ed457a5475c3e0a6
342,Skirts,Karen Kane Women's Leopard Knit Skirt,Karen Kane,98,Women,360252,3d15cdae0a1eebd6bd4d0ae7fb9b4675
343,Accessories,Ray-Ban RB3293 Bubble Wrap Aviator Sunglasses,Ray-Ban,125,Men,4304,4641fade5856f122a7f40fa936444a26
344,Skirts,Mango Women's Slits Sheer Maxi Skirt - Elastic,MANGO,59.99,Women,72886,97483a8ab1ae2bd1b801926a8e238045
345,Socks & Hosiery,K. Bell Socks Women's Golf Argyle/stripe 2 Pack Footie Socks,K. Bell,10,Women,75733,9758054c1cf079c2e004ec276225499a
346,Leggings,The Skull Patch Legging,Yelete,24.99,Women,362358,07188fc5d7ef67feab9c2838544fe029
347,Blazers & Jackets,Allegra K Ladies Padded Shoulder Long Sleeve Form Fitting Textured Blazer Black XS,Allegra K,24.03,Women,812382,102e418a15b64b9d23504b6d884975bc
348,Clothing Sets,"Scrunch Cloth Pants Set / Regular - Only Sale Color(s) Cardinal, Strawberry",Orvis,129,Women,491566,395554d98dfa00996576753b984a72f8
349,Underwear,Fruit of the Loom Men's Men's Thermal Crew Top / Shirt - Navy,Fruit of the Loom,13.79,Men,80509,8dc4f69d9751f7a6ea5e8f69c18ba1ff
350,Skirts,Jones New York Women's Petite Slim Skirt,Jones New York,38.36,Women,123572,8a866bd2969d3942bccffafef8a11354
351,Shorts,Farah Men's Mayhew Pant,Farah,25,Men,51329,14ba4a05c478a48b63628e481efdcc82
352,Active,CW-X Women's Insulator Stabilyx Tights,CW-X,120,Women,9359,2c57df7428badac8cd7b40dafea984f7
353,Swim,Brazilian Bikini top by Sheridyn Swim,Sheridyn Swim,19.9,Women,12732,b865035ddd4347ac3b012e64e46b4ae5
354,Sleep & Lounge,KNOTHE Comfort Pant In Black Or Navy #13438,Knothe,43.7,Men,609368,df17e59f100475ebe98234d83a29e624
355,Socks & Hosiery,HUE Women's Relaunch Tulle Dot,HUE,11.12,Women,8857,c96822283ebded500e73458357f8e38b
356,Sweaters,Banana Republic Men's Maroon w/Brown Crew Neck Sweater,Banana Republic,49.97,Men,503721,926e6c1afe47faaa8307e833bb8dc3b6
357,Accessories,Fennco Ruffle Cotton Long Scarf - 8 Colors,Fennco,18.99,Women,10836,d4d524a3b457dbae5c12233ba2cba758
358,Sleep & Lounge,Diesel Men's Paul Sleep Pant,Diesel,49.59,Men,210614,509e783258f377e5e4e862c1a22989b3
359,Socks,Baltimore Ravens 2012 Colorblock Mens Sneaker Slippers,Forever Collectibles,22.99,Men,63441,24f5896e0dccb3f39c384e0ba61671c6
360,Sleep & Lounge,Sweet Juniors Animal Print Kimono Robe,Sweet,25,Women,13130,a5182196cf22f46a58d31fd11b9481c0
361,Tops & Tees,Hurley Sun Also Sets T-Shirt - Short-Sleeve - Women's,Hurley,22,Women,29403,9aacc243b86d002a8f8326d7df1222d2
362,Pants,Dockers Men's Limited Offer Explorer Khaki Pant,Dockers,49.99,Men,427443,03776a19f3720539b94b68e328a7fe75
363,Socks,Puma Men's 3 Pack 1/2 Terry QTR,PUMA,12,Men,38832,7d4e7245e4e23aa4026fb34f629af438
364,Swim,Oneill Men's Jordy Freak,O'Neill,55.95,Men,249404,848352d18e621325710b179f0b730d09
365,Leggings,Soho Apparel 100% cotton Very Comfortable Casual Track shorts with drawstring SGS-98,Soho Girls,11.99,Women,549974,c4990ea44153969f4d8e6ba15ff7b0b4
366,Socks,"Bjorn Borg Men's Socks, Patterned No Channel Stripe",Bjorn Borg,11.95,Men,433344,4441c0eee41000638f8c9dcb3fc0beff
367,Tops & Tees,Guide Gear Fleece - lined Denim Shirt Light Wash,Guide Gear,34.99,Men,11516,a70bc0fc04a77fb88739676ee6df91a3
368,Clothing Sets,Womens Top Stitch Jacket and Pant Set by City Lights,City Lights,199.95,Women,419117,9f5ac1ed41e71f4f8f13ca3e5d489db0
369,Active,Life is Good Heart Four Seasons Shirt Womens,Life Is Good,35,Women,53587,640a6c2492cafdf594a9e9f88161e7b5
370,Suits & Sport Coats,Paul Fredrick Cotton Velvet Two-Button Houndstooth Sportcoat,Paul Fredrick,269.5,Men,630782,e1d0ef1d2bc92040f61932dd2a13d003
371,Intimates,Avenue Plus Size Black Cheeky Lace Panty,Avenue,12.9,Women,61314,db86e9613b493e4c14964b7355267c51
372,Plus,Suncloud Optics King Sunglasses,Suncloud,39.98,Women,94032,aa425ae8540060ddd2605346566b050b
373,Skirts,Vip Boutique Womens Peplum Frill Mini Skirt,VIP BOUTIQUE,11.99,Women,29582,5bc51358ec13e35db8df4d8f64043d93
374,Active,Nike Classic Fleece Hooded Top,Nike,39.89,Men,17236,5137617d95853d30b6f9b78731296a1e
375,Sleep & Lounge,Daniel Buchler Men's Square Robe,Daniel Buchler,68.6,Men,306630,3f1295439c8fe00947ffc110e0cf2761
376,Maternity,Port Authority - Maternity Long Sleeve Easy Care Shirt.,Port Authority,29.73,Women,214259,039dc046e19593f6f0a0d3f784bcfa5f
377,Leggings,Allegra K Dark Gray Elastic Waist Closefitting Legging S for Women,Allegra K,10.02,Women,52800,232a33639168eaed1b68819449aa35d8
378,Shorts,LRG Core Collection TS Chino Short - Men's,LRG,55.95,Men,568128,f33a48c7b1072bc8b62a16b7ead065c8
379,Socks,Gold Toe Men's ADC Aquafx Adams Rib Over the Calf Dress Sock,Gold Toe,10.99,Men,12107,50e76cd5ec3db998319d93304a664ab1
380,Shorts,Cutter & Buck Big & Tall Terrace Canvas Shorts,Cutter & Buck,68,Men,108560,ca00f608f7d8be26e6f9ea6063a8fb6a
381,Outerwear & Coats,Devon & Jones Pink Women's Signature Colorblock Jacket DP965W,Devon & Jones,25,Women,11432,a2430f841be0da9e2dc80375307cddfa
382,Plus,Sock It To Me Giraffe Knee High Sock (Light Green),Sock It To Me,25,Women,1757,7ecdb375669164dd1052395aa25bda2e
383,Shorts,Ed Garments Women's Flat Front Brass Zipper Cargo Short. 8468,Ed Garments,32.99,Women,199832,482727edbe03d6402d65bd9e8b7e382b
384,Outerwear & Coats,Carhartt Men's Big & Tall Duck Active Quilted Flannel Lined Jacket,Carhartt,109.99,Men,1013816,b99bd66ccf79c7f3dd99d49ab373a0ac
385,Pants,IZOD Men's Saltwater 5-Pocket Straight Fit Corduroy Pant,IZOD,39.99,Men,25693,1b8d040f412f4beefd094dde5d337a18
386,Swim,Rip Curl Men's Mirage Hektic Short,Rip Curl,69.5,Men,287155,4bbb6ecdc2e35cbd04a71d55bdb0ec16
387,Suits & Sport Coats,Mens Designer Blue Pattern Tuxedo for Men Vest Set Match Necktie Cufflinks Bowtie Hanky Set for Suit Y&G VS1020,Y&G,36.95,Men,183734,655b6a806db46d32ce042dcd8f3a5fbd
388,Jumpsuits & Rompers,Motel The Rowen Romper in Hyacinth,Motel,90,Women,896612,e61a93a3d735261d5466af80915d92d1
389,Pants,Dickies TP2477 Men's Sanded Duck Insulated Pant,Dickies,76.99,Men,143437,9348ae797078fcf4aeef8b912a6e99c6
390,Fashion Hoodies & Sweatshirts,Burnside Men's Chipper Solids Knit Hood Shirt,Burnside,25,Men,33423,ad6121a87a07a7c8e4a10a4014e0aff2
391,Intimates,Laura High Quality Sexy Aqua Seamless Bra Bikini SET #SL101069 Made in Colombia,Laura,34.95,Women,556994,dbd6bb474e5f5dc37c1f1a99db8cfd49
392,Underwear,Champion Men's Performance 2 Pack Stretch Boxer Brief,Champion,20,Men,416,3abb1f4676a56cbcd018f878d1bd6f26
393,Jeans,Not Your Daughters Jeans Charlotte Trouser Black,Not Your Daughter's Jeans,98,Women,279005,e195d96bea4099182eb34eb68026d23a
394,Swim,LUXE By Lisa Vogel - Pandora Flutter Bikini Top,LUXE By Lisa Vogel,73,Women,236679,f015f78fb3080f42d2bc578e64f92202
395,Sleep & Lounge,Tommy Hilfiger Women's Ribbed Henley/flannel Pajama Pant Gift Set,Tommy Hilfiger,40.8,Women,64875,04b124c62419b6ee6c76619de9fcfc2a
396,Outerwear & Coats,Armani Exchange Cotton PVC Moto Jacket,A:X Armani Exchange,160,Men,54365,0b745a25692274f03dc0b65b98cfe3df
397,Leggings,Leggings for Lady eM,B. B. Jeans Fashion,15,Women,447554,e57a088721cfa0b3f388652b3a31b286
398,Pants,Kenneth Cole Reaction Linen Leno Heather 044 Grey Flat Front Dress Pants,Kenneth Cole,52.5,Men,401396,43451d771afd7d0703a4cc4988cd9c3b
399,Accessories,Isotoner Women's Button Cashmere Lined Glove,Isotoner,36.99,Women,11865,35cdb4adc0069bdc4fa21042b0b315f9
400,Shorts,Joe's Jeans Women's Bright Color Short,Joe's Jeans,25,Women,109867,20d1c1bd39b01a4d60052c20d28d8312
401,Jeans,Seven7 Women's Skinny Snake77 Stone Jean,Seven7,69,Women,145880,760ca3e2a42aaadc5f0e4593ed7d82d3
402,Suits,ICE (2347) Pencil Skirt Stretch Sateen + Free Belt Silver Grey Size 6-16,Ice,25.99,Women,1237664,fee8be5533566b363763da137ef67273
403,Pants,Allegra K Men Elastic Waist Zip Fly Front Pockets Harem Trousers Black W30,Allegra K,18.56,Men,187259,f27e020c37986484e961fbedc9b9ce75
404,Maternity,Mother TuckerTM Compression Nursing Tank - Nude - M,Belly Bandit,79.95,Women,364394,81812bcabc5d4b793f84cd12c51eef9d
405,Sleep & Lounge,Harbor Bay Big & Tall Cotton Fleece Robe,Harbor Bay,86,Men,211005,af08c996bbdd4f5993156dbf85f89a34
406,Fashion Hoodies & Sweatshirts,Generation19 2 Tone Varsity Hoodie Jacket Women's,Honey Bun,24,Women,117755,d46ec0d7fd42520bb155ee5366f25bb9
407,Socks & Hosiery,K. Bell Socks Womens Merino Paisley Crew Socks,K. Bell,15,Women,39657,1e218b528903adbbfeb2f6a9f131f5ed
408,Pants,Kenneth Cole Men's Five Pocket Pant,Kenneth Cole,69.5,Men,42817,617442a5972a57f234175642ecda227b
409,Sleep & Lounge,Hanro Men's City Pajama Set,Hanro,230,Men,303098,689ed36b0fc1de9d8dec4450b56dfafb
410,Underwear,Hanes Men's Boxer Brief 4 Pack,Hanes,25,Men,2615,22e8c1052f99124b83890b4155520b2f
